{
  "schemaVersion": 1,
  "version": "0.3.3",
  "sourceCommit": "dfce4e6a93d7442e267868d8716cf882791f6155",
  "architecture": "x64",
  "windowsBuild": 26200,
  "codexFileBuild": "151.0.7922.170",
  "completedAt": "2026-08-23T12:20:45Z",
  "cases": {
    "visual": [
      {
        "layout": "wide",
        "scale": 100,
        "theme": "light",
        "language": "en",
        "result": "pass"
      },
      {
        "layout": "wide",
        "scale": 100,
        "theme": "light",
        "language": "zh-CN",
        "result": "pass"
      },
      {
        "layout": "wide",
        "scale": 100,
        "theme": "dark",
        "language": "en",
        "result": "pass"
      },
      {
        "layout": "wide",
        "scale": 100,
        "theme": "dark",
        "language": "zh-CN",
        "result": "pass"
      },
      {
        "layout": "wide",
        "scale": 100,
        "theme": "system",
        "language": "en",
        "result": "pass"
      },
      {
        "layout": "wide",
        "scale": 100,
        "theme": "system",
        "language": "zh-CN",
        "result": "pass"
      },
      {
        "layout": "wide",
        "scale": 125,
        "theme": "light",
        "language": "en",
        "result": "pass"
      },
      {
        "layout": "wide",
        "scale": 125,
        "theme": "light",
        "language": "zh-CN",
        "result": "pass"
      },
      {
        "layout": "wide",
        "scale": 125,
        "theme": "dark",
        "language": "en",
        "result": "pass"
      },
      {
        "layout": "wide",
        "scale": 125,
        "theme": "dark",
        "language": "zh-CN",
        "result": "pass"
      },
      {
        "layout": "wide",
        "scale": 125,
        "theme": "system",
        "language": "en",
        "result": "pass"
      },
      {
        "layout": "wide",
        "scale": 125,
        "theme": "system",
        "language": "zh-CN",
        "result": "pass"
      },
      {
        "layout": "wide",
        "scale": 150,
        "theme": "light",
        "language": "en",
        "result": "pass"
      },
      {
        "layout": "wide",
        "scale": 150,
        "theme": "light",
        "language": "zh-CN",
        "result": "pass"
      },
      {
        "layout": "wide",
        "scale": 150,
        "theme": "dark",
        "language": "en",
        "result": "pass"
      },
      {
        "layout": "wide",
        "scale": 150,
        "theme": "dark",
        "language": "zh-CN",
        "result": "pass"
      },
      {
        "layout": "wide",
        "scale": 150,
        "theme": "system",
        "language": "en",
        "result": "pass"
      },
      {
        "layout": "wide",
        "scale": 150,
        "theme": "system",
        "language": "zh-CN",
        "result": "pass"
      },
      {
        "layout": "wide",
        "scale": 200,
        "theme": "light",
        "language": "en",
        "result": "pass"
      },
      {
        "layout": "wide",
        "scale": 200,
        "theme": "light",
        "language": "zh-CN",
        "result": "pass"
      },
      {
        "layout": "wide",
        "scale": 200,
        "theme": "dark",
        "language": "en",
        "result": "pass"
      },
      {
        "layout": "wide",
        "scale": 200,
        "theme": "dark",
        "language": "zh-CN",
        "result": "pass"
      },
      {
        "layout": "wide",
        "scale": 200,
        "theme": "system",
        "language": "en",
        "result": "pass"
      },
      {
        "layout": "wide",
        "scale": 200,
        "theme": "system",
        "language": "zh-CN",
        "result": "pass"
      },
      {
        "layout": "narrow",
        "scale": 100,
        "theme": "light",
        "language": "en",
        "result": "pass"
      },
      {
        "layout": "narrow",
        "scale": 100,
        "theme": "light",
        "language": "zh-CN",
        "result": "pass"
      },
      {
        "layout": "narrow",
        "scale": 100,
        "theme": "dark",
        "language": "en",
        "result": "pass"
      },
      {
        "layout": "narrow",
        "scale": 100,
        "theme": "dark",
        "language": "zh-CN",
        "result": "pass"
      },
      {
        "layout": "narrow",
        "scale": 100,
        "theme": "system",
        "language": "en",
        "result": "pass"
      },
      {
        "layout": "narrow",
        "scale": 100,
        "theme": "system",
        "language": "zh-CN",
        "result": "pass"
      },
      {
        "layout": "narrow",
        "scale": 125,
        "theme": "light",
        "language": "en",
        "result": "pass"
      },
      {
        "layout": "narrow",
        "scale": 125,
        "theme": "light",
        "language": "zh-CN",
        "result": "pass"
      },
      {
        "layout": "narrow",
        "scale": 125,
        "theme": "dark",
        "language": "en",
        "result": "pass"
      },
      {
        "layout": "narrow",
        "scale": 125,
        "theme": "dark",
        "language": "zh-CN",
        "result": "pass"
      },
      {
        "layout": "narrow",
        "scale": 125,
        "theme": "system",
        "language": "en",
        "result": "pass"
      },
      {
        "layout": "narrow",
        "scale": 125,
        "theme": "system",
        "language": "zh-CN",
        "result": "pass"
      },
      {
        "layout": "narrow",
        "scale": 150,
        "theme": "light",
        "language": "en",
        "result": "pass"
      },
      {
        "layout": "narrow",
        "scale": 150,
        "theme": "light",
        "language": "zh-CN",
        "result": "pass"
      },
      {
        "layout": "narrow",
        "scale": 150,
        "theme": "dark",
        "language": "en",
        "result": "pass"
      },
      {
        "layout": "narrow",
        "scale": 150,
        "theme": "dark",
        "language": "zh-CN",
        "result": "pass"
      },
      {
        "layout": "narrow",
        "scale": 150,
        "theme": "system",
        "language": "en",
        "result": "pass"
      },
      {
        "layout": "narrow",
        "scale": 150,
        "theme": "system",
        "language": "zh-CN",
        "result": "pass"
      },
      {
        "layout": "narrow",
        "scale": 200,
        "theme": "light",
        "language": "en",
        "result": "pass"
      },
      {
        "layout": "narrow",
        "scale": 200,
        "theme": "light",
        "language": "zh-CN",
        "result": "pass"
      },
      {
        "layout": "narrow",
        "scale": 200,
        "theme": "dark",
        "language": "en",
        "result": "pass"
      },
      {
        "layout": "narrow",
        "scale": 200,
        "theme": "dark",
        "language": "zh-CN",
        "result": "pass"
      },
      {
        "layout": "narrow",
        "scale": 200,
        "theme": "system",
        "language": "en",
        "result": "pass"
      },
      {
        "layout": "narrow",
        "scale": 200,
        "theme": "system",
        "language": "zh-CN",
        "result": "pass"
      },
      {
        "layout": "right-pane",
        "scale": 100,
        "theme": "light",
        "language": "en",
        "result": "pass"
      },
      {
        "layout": "right-pane",
        "scale": 100,
        "theme": "light",
        "language": "zh-CN",
        "result": "pass"
      },
      {
        "layout": "right-pane",
        "scale": 100,
        "theme": "dark",
        "language": "en",
        "result": "pass"
      },
      {
        "layout": "right-pane",
        "scale": 100,
        "theme": "dark",
        "language": "zh-CN",
        "result": "pass"
      },
      {
        "layout": "right-pane",
        "scale": 100,
        "theme": "system",
        "language": "en",
        "result": "pass"
      },
      {
        "layout": "right-pane",
        "scale": 100,
        "theme": "system",
        "language": "zh-CN",
        "result": "pass"
      },
      {
        "layout": "right-pane",
        "scale": 125,
        "theme": "light",
        "language": "en",
        "result": "pass"
      },
      {
        "layout": "right-pane",
        "scale": 125,
        "theme": "light",
        "language": "zh-CN",
        "result": "pass"
      },
      {
        "layout": "right-pane",
        "scale": 125,
        "theme": "dark",
        "language": "en",
        "result": "pass"
      },
      {
        "layout": "right-pane",
        "scale": 125,
        "theme": "dark",
        "language": "zh-CN",
        "result": "pass"
      },
      {
        "layout": "right-pane",
        "scale": 125,
        "theme": "system",
        "language": "en",
        "result": "pass"
      },
      {
        "layout": "right-pane",
        "scale": 125,
        "theme": "system",
        "language": "zh-CN",
        "result": "pass"
      },
      {
        "layout": "right-pane",
        "scale": 150,
        "theme": "light",
        "language": "en",
        "result": "pass"
      },
      {
        "layout": "right-pane",
        "scale": 150,
        "theme": "light",
        "language": "zh-CN",
        "result": "pass"
      },
      {
        "layout": "right-pane",
        "scale": 150,
        "theme": "dark",
        "language": "en",
        "result": "pass"
      },
      {
        "layout": "right-pane",
        "scale": 150,
        "theme": "dark",
        "language": "zh-CN",
        "result": "pass"
      },
      {
        "layout": "right-pane",
        "scale": 150,
        "theme": "system",
        "language": "en",
        "result": "pass"
      },
      {
        "layout": "right-pane",
        "scale": 150,
        "theme": "system",
        "language": "zh-CN",
        "result": "pass"
      },
      {
        "layout": "right-pane",
        "scale": 200,
        "theme": "light",